cid,Comment,time,author,channel,votes,replies,photo,heart,reply,time_parsed
Ugz9VGsDUNGO8baPJTB4AaABAg.8uPNgxUiG1B9LcJ8yaIflx," @JMan9191991  are you sure about this? Because I remember seeing this or something like this at the time the movie was coming out, featuring Cochise and Black Sabbath. I remember the trailer being very transparent as well. There was definitely more than one trailer at the time of release because I also remember seeing the more traditional version that revealed less and thinking to myself, where is the one with Cochise??",3 years ago,@artbymiwsher,UChpdCPBeiUYU4_S7hAz9KvQ,0,,https://yt3.ggpht.com/UYFShj7WihbeJYCceo7UtuL7ZllHKj2TSGsRQEhkQCL7G-myhtbgd3qRZDPfK0MuFVUwobnK=s88-c-k-c0x00ffffff-no-rj,False,True,1639357760.376423
Ugz9VGsDUNGO8baPJTB4AaABAg.8uPNgxUiG1B9MxNOjWvSiV,I think its because we've already watched the movie. If we we were watching this trailer before the movie we wouldn't have any Idea abt the movie.,3 years ago,@danielsabu2981,UCVKRx4MsT2cajR1WAsQYpRg,0,,https://yt3.ggpht.com/ytc/AIdro_nGGsjK1owP_czbrv8yfO-dvvM-wdXNVMtngY2g2F2I6w=s88-c-k-c0x00ffffff-no-rj,False,True,1639357760.378424
UgyFxVvotnL9eXtmaYh4AaABAg.9I7cYxRcLBo9h_noInS15x,"Fr I feel jealous about new MCU comers sometimes. They can just watch the whole Infinity saga right now. It's at their disposal. However people like me had to wait ten years in between iron man and endgame. They will never know the anticipation, hype and struggle waiting for these movies to come out. Especially in between Infinity war and Endgame. That's all anyone was thinking about in 2018 and 2019",2 years ago,@eianblosch3341,UCC8xVdKcj8VvP72Q-w1i1Vw,12,,https://yt3.ggpht.com/7Lzl4w7i9AHUeBqOtpBwei6x8LG8g0Jt_LFiQQxhrOKLxE9sSm4fVTpQqZJG0dD1GXWUXHLp2Q=s88-c-k-c0x00ffffff-no-rj,False,True,1670893760.814271
UgyFxVvotnL9eXtmaYh4AaABAg.9I7cYxRcLBo9jFGGHPxxth,I'm proud that I am a kid and got to watch the first ironman and everything else that came out. Really makes my childhood,2 years ago,@jasoncarrillo48,UCrvU05tYnk6njjHk0Zwo1wQ,2,,https://yt3.ggpht.com/Qgvvjyf2f0kfQDAhExrTCITkWVqT82TOB8wFmXjMsEhREyra93mSPnAjew_Ye7ufQ9WEyBzx=s88-c-k-c0x00ffffff-no-rj,False,True,1670893760.815269
UgyFxVvotnL9eXtmaYh4AaABAg.9I7cYxRcLBo9lSAlfApAxP,"With the multiverse saga, people will still know what it’s like to watch it unfold and a story slowly come to fruition. When the multiverse saga ends in 2026, 2027 kids will know. Until the final saga, the emotion of watching day one to the end credits will still feel the same.",1 year ago,@Allison_XypprZ,UCc46HSrwNwnv7DRLL4ya5pQ,2,,https://yt3.ggpht.com/OlGeSWv9D2fQ9-25_suLHiIgxMlRh4SDu4iu6yAP2KTJ0Z1llrR13a0Hp4pOM3KoXwN-2uoKgg=s88-c-k-c0x00ffffff-no-rj,False,True,1702429760.81727
UgwVJswxUMnL9xo_pA94AaABAg,"We have come from a long way...

... I'm with this franchise 'til the end of the line.

Edit: Alas, the end of the line turned out to be Endgame.",6 years ago (edited),@rogerkincaid931,UCmMBIP6gALJXEux3Mdugb9Q,238,7,https://yt3.ggpht.com/ytc/AIdro_kLkVQGqQYLFQTPFuTwrRUrBuTaG5o6AX1PuXuiukg-NQ=s88-c-k-c0x00ffffff-no-rj,False,False,1544663362.176058
Ugy-ucYyMenWfqZ_bd14AaABAg,Every single second of this movie feels to be made with so much heart and care.... Something sadly absent in most of those today,2 years ago,@nerds3k,UCGMcfzyQHwH1sTEbqZ3kkyQ,3,,https://yt3.ggpht.com/SYnIq3AZJzOZSKKwJzacRe6TkvOo9igcY8EZ7zq7OFOQbj_IXy2dTKUwuC6oVyN73JIFw-aGNbw=s88-c-k-c0x00ffffff-no-rj,False,False,1670893762.178026
UgxEph38abLfhFeLP594AaABAg,"12 years ago today, the Marvel Cinematic Universe was born! Iron Man led the charge! We love you 3000, Tony!",4 years ago,@jairbear619,UCNz41R1WMTmnROYFpFrzcDQ,6,,https://yt3.ggpht.com/ytc/AIdro_n4Sv_VQQOw_grbJTFdRq-RnBcQV4zVnTkAdHDofAhY0BBmn7igkzmdIiYYniWMpQV9O4Q=s88-c-k-c0x00ffffff-no-rj,False,False,1607821762.179057
UgwJrr-YufNh-ollLSV4AaABAg,Seems like a good movie hope they make an entire universe full of superhero movies for over a decade and at the end make one of the most anticipated crosovers with all the movie characters combined. That would be awsome!,4 years ago,@kaan9510,UCDgNSry6EyWL0pA-DQ_Co-A,37,,https://yt3.ggpht.com/lKMAUev1u_DmsWtsbqQVl9cFL1dYG6sjGAHzLU1IIMRCdSpftnMdIE5q28qC0k4KjPXx1xOVjQ=s88-c-k-c0x00ffffff-no-rj,False,False,1607821762.180062
Ugxqcyhbpnj14RXrtpN4AaABAg,I'm here after watching the trailer for the multiverse of madness... It's incredible how it all started with one man,2 years ago,@lincoln2324,UClGN7cacls2SWT2MOT03YuA,8,,https://yt3.ggpht.com/ytc/AIdro_ko9hVqfnqjMVUczcC3ktXnhvVMArXX9pRqaDmZz2Ehlg=s88-c-k-c0x00ffffff-no-rj,False,False,1670893762.185061
UgywAynjslkQWefjhx54AaABAg,"I saw this knowing NOTHING about Iron Man and did it cuz I loved the Spider-Man, X-Men and Fantastic 4 movies at that time and I walked out loving it and most of what’s come from this now 16 year old cinematic universe.",6 months ago,@ytuser_3122,UCpJ-3CXR1jSsn2HjvOuPHYA,3,,https://yt3.ggpht.com/2DLf9Cq-9iRNWPCn6I-vt_6i7z-tmBF-fTbesIOvUQy0P_qcAeUo71VZhAvu-GrVdeCg1CTqGxM=s88-c-k-c0x00ffffff-no-rj,False,False,1718237362.186059
UgweH0rESWtU8I1_cil4AaABAg,"The excitement is what brought people to the MCU. That’s long gone. And the fans are long gone. This movie is a gem. Not even made by Disney. It’s like the Blade franchise. This is Marvel, not Disney. Not anymore.",11 months ago,@michaelsuk6440,UCgTGhJJmSVINC59fD_Jwzew,0,,https://yt3.ggpht.com/ytc/AIdro_lzu9fx-bpKV8lEDMYUPCP3rcYhID3zSMLR_vNJcOsvaks=s88-c-k-c0x00ffffff-no-rj,False,False,1705108162.194029
UgwJdGfAInJJ_2sezVN4AaABAg,that ending shot in this trailer where Iron man walks away with that tank explosion is beyond epic!!!,4 years ago,@deansamos7372,UCKhIBsPYa-NYb7FvjpVLH6A,28,,https://yt3.ggpht.com/ytc/AIdro_koRtQTuIwjQ4FP3RZVg1uE66PaOdUeqFgH8lWkw-1bt37GjlJuRBJ7yTL7l5mFm3VeNQ=s88-c-k-c0x00ffffff-no-rj,False,False,1607821763.077017
Ugx6nWbgDp-646PXMVR4AaABAg,"My first time watched Ironman when i was in the high school and last time i watched GOTG Vol. 3, i'm 30 y.o. with master degree, time flies so fast",1 year ago,@streamspoart2671,UCXqrndjr380_1eOl82a8pdQ,1,,https://yt3.ggpht.com/ytc/AIdro_m5cqeFu4NZWkMKTK1iROui8HfbYlNjb1rff5W8RI8=s88-c-k-c0x00ffffff-no-rj,False,False,1702429763.087987
UgzGK30OC_8Ye0ehPsR4AaABAg,"I remember right before this premiered I was so hyped reading Spiderman, Iron man and Avengers comics before most knew who they were aside from Spiderman",3 years ago,@donlewis4375,UC79FU0ESyjzoB0XFNThROWA,5,,https://yt3.ggpht.com/ytc/AIdro_mmSAZi9C8QhIhlG5snzPwPFwJp0BXo0yTNpPbkO-5KCQ=s88-c-k-c0x00ffffff-no-rj,False,False,1639357763.09202
UgwUpjy1ckdqIGW4HJN4AaABAg,I wanna time travel back to 2008 again when I was a kid because I miss when Marvel was good and fantastic since my childhood.,1 year ago,@jacobgarrity651,UCXnISfI3cEuYmvWHwZR5abA,1,,https://yt3.ggpht.com/ytc/AIdro_mt_NP8jvb0TurdkUMiek6vfznnTb-Eg0EZRQSmfi4=s88-c-k-c0x00ffffff-no-rj,False,False,1702429763.094021
UgyfTlJhVkIgthCVQI54AaABAg,"Still my favorite MCU solo film. I really wonder how they MCU would have been if it stayed with this tone throughout the entire things even up until now before Disney bought out Marvel. I mean sure it's cool we got the biggest superhero team up ever with Infinity War and Endgame buy after phase 1 it became more kid friendly with jokes that coveted half of each movie. This is why the best Solo movies in the MCU is Iron Man 1 and The Winter Soldier, Thor Ragnarok is great but it's more of a comedy than anything",3 years ago,@POPINCONEJO88,UC2-_I1SK5-tvJ6U4gR3ku9Q,14,3,https://yt3.ggpht.com/ytc/AIdro_mm1pLyb_yc540cJLDh2SNItWzb3GEQHnHIFMhHCyHCFQ=s88-c-k-c0x00ffffff-no-rj,False,False,1639357763.102047
UgwKU0D2HvWUdFYLm914AaABAg,Reminiscing on how far we’ve come. Like damn. I was 7 when this came out and I’ll be 25 when Secret Wars land😭MCU and Star Wars have been my childhood,2 years ago,@fernandojuarez329,UCLo7yP10aQAnwNCHPX9PgPg,2,,https://yt3.ggpht.com/qiYuUmrxdyJNqWD3aF1TMX6K4OLjJTXmhUh4JSszqI-J3BULVYLt63BFXAaNkOY5yG7e2ISMZQ=s88-c-k-c0x00ffffff-no-rj,False,False,1670893763.10407
Ugzly-5pA5UXUQrIeH54AaABAg,"The Infinity Saga starts here from Phase One to Phase Four.

Phase One:
Iron Man (2008)
The Incredible Hulk (2008)
Iron Man 2 (2010)
Thor (2011)
Captain America: The First Avenger (2011)
The Avengers (2012)


Phase Two:
Iron Man 3 (2013)
Thor: The Dark World (2013)
Captain America: The Winter Soldier (2014)
Guardians of the Galaxy (2014)
Avengers: Age of Ultron (2015)
Ant-Man (2015)


Phase Three:
Captain America: Civil War (2016)
Doctor Strange (2016)
Guardians of the Galaxy Vol. 2 (2017)
Spider-Man: Homecoming (2017)
Thor: Ragnarok (2017)
Black Panther (2018)
Avengers: Infinity War (2018)
Ant-Man and the Wasp (2018)
Avengers: Endgame (2019)
Spider-Man: Far From Home (2019)


Phase Four:
Black Widow (2020)
The Eternals (2021)
Shang-Chi and the Legend of the Ten Rings (2021)
Spider-Man: Home Run (2021)
Doctor Strange in the Multiverse of Madness (2022)
Thor: Love and Thunder (2022)
Black Panther II (2022)",4 years ago,@efrainjunior2409,UCynR3H_Kk1Hs3WMPlDLPdrQ,4,2,https://yt3.ggpht.com/ytc/AIdro_k1N3-Bq7gNaYXfp3C1KuLArXS77DLfD_lhsrSqZpHsl_Y=s88-c-k-c0x00ffffff-no-rj,False,False,1607821763.105068
UgwOCFk0ge4qtd57vIZ4AaABAg.9Bg9J4Og-ij9FsVoB4KRp1,Yea man. The Marvel Cinematic Universe has literally been apart of my Childhood. Really love the first Iron Man movie as a younger kid.,4 years ago,@warknightxl2167,UCfqAA-IN2CbtuvuSiVQFjbw,2,,https://yt3.ggpht.com/ytc/AIdro_njaPYAgNhVKvqFDg9NuAgkKMwXWZKPrNNT13RNo0JXk5w=s88-c-k-c0x00ffffff-no-rj,False,True,1607821763.51803
UgyfTlJhVkIgthCVQI54AaABAg.9OJDnTcuCPy9VfR_B-bFby,You do know winter soldier was made by Disney right? Also Thor Ragnarok was away better than the 1st one which wasn't made by disney,3 years ago,@brandonv6905,UCdWjvYV7aDfURnMZdi43M0A,1,,https://yt3.ggpht.com/ytc/AIdro_nvM71ZpqkmVs2lIR85JClDbSpLanoBVpD85WjwKBvJwQ=s88-c-k-c0x00ffffff-no-rj,False,True,1639357763.731169
Ugzly-5pA5UXUQrIeH54AaABAg.98wFkjj5v0f9F4CQuSNJy-,"Oh ok. Second, does he already know that the Infinity Saga is finished already? Phase four is NOT part of the Infinity Saga.",4 years ago,@vloggamingmaster9730,UCB1IwGLizz5zt9bxO-wYEDw,0,,https://yt3.ggpht.com/ytc/AIdro_lcTO0JDsGG4dAyUxfUSyfcqBDpZY5qnOTr82nHGCs90bE=s88-c-k-c0x00ffffff-no-rj,False,True,1607821763.986842
UgzbDllCW2ZkCfz64Dd4AaABAg,"Holy crap, it’s been so long that I had forgotten that the trailer literally gave away the entire movie.",7 months ago,@Erdrick68,UCOIRLg0pUBzKCL0tLqktNFQ,2,,https://yt3.ggpht.com/ytc/AIdro_mn3X0etf2F2SbWMBEhVxKCHLSLjhPDI7XnIYRBeLI=s88-c-k-c0x00ffffff-no-rj,False,False,1715558964.381562
UgzspbtOdTfaOVTqVsl4AaABAg,"Show of hands for those of you like me followed this straight from Ironman to Endgame..from the first I am ironman to the last i am ironman..
Some people forget..some people move on..not us
Not us",4 years ago,@dcdodo2323,UCzS7dMj8NjfocVNEWBd7o_w,17,3,https://yt3.ggpht.com/ExUrhPlI_F2DXWyZrwHbTYAiL_-6Wii_fleUT-jGeFLaOohPz_tEAkIosdtHCK4pkK9AeD4foL0=s88-c-k-c0x00ffffff-no-rj,False,False,1607821764.384559
UgyGY19dZ1724AcSnMd4AaABAg,"Thank you disney+ for streaming this and iron man 2 and iron man 3 now i csn watch them fot 1,000 more times😍😍😍😭😭😍😍😍😍😍😍😍😍😍😍😍😍😍😍😍😍😍😍😍😍😍😍😍😍😍😍😍😍😍😍😍😍😍😍😍😍😍😍😍😍😍😍😍💁🏻😏❤️",4 years ago,@jennifertran70462,UC50QEGaTuKF-a-br8Y6XEHg,3,,https://yt3.ggpht.com/ytc/AIdro_nSdT_QR5a-69jjsokN4n5x1whxAaZehobLho2nCY8=s88-c-k-c0x00ffffff-no-rj,False,False,1607821764.385558
UgxSjd-dlXNN7bJN7754AaABAg,"cant believe the library of congress preserved this movie in the national film registry for being ""culturally, historically, or aesthically significant"". amazing",1 month ago,@MisterAhmad89,UCJQdjVGw38psuvgLRm9-Rww,1,,https://yt3.ggpht.com/ytc/AIdro_k489dbUjVHiavMXCVBLGMHjuZ1MbGhFgMATRJyE25ZAk1KhQl3s6Hf7REnBDXFhbKjBA=s88-c-k-c0x00ffffff-no-rj,False,False,1731460164.393559
UgzetpTd6JKBVsYPhpZ4AaABAg,To you whom has come back to this masterpiece that started everything 12 years ago i wish the best of luck and hope they get rich❤️🍀,4 years ago,@e4411,UCBLlLv99INUYQ7Qy-wJFI4w,8,,https://yt3.ggpht.com/ytc/AIdro_lJEDObGt2goqyrhRmXZrxKt6s4GamRhaCLnfFaIEllQNA=s88-c-k-c0x00ffffff-no-rj,False,False,1607821764.394565
UgwKqIK1eUQ-x3ralbF4AaABAg,"The film that was the beginning of the path of his comeback, Here’s to Oscar Winning Actor Robert Downey Jr.",9 months ago (edited),@calebcold3,UCMsL-BIHU_EEC0N2ZOP_NKg,1,,https://yt3.ggpht.com/XWGA15Atc1eyR3G3UiV4tVsDh5YzrreUuRCd-JBNQmHmmkofmE11n4E29xgvWFS5KXkTrpAs=s88-c-k-c0x00ffffff-no-rj,False,False,1710288565.291385
UgwGKylaxf0Tb6KZO2p4AaABAg,"Tenía solo 5 años en el 2008 y era feliz y no lo sabía, hubo muy buenas películas en ese año como wall-e, el increíble hulk, kung fu panda, el caballero de la noche y iron man",4 years ago (edited),@nixco4894,UCjTDAX4hIz0-5FmyzAeLT6g,6,,https://yt3.ggpht.com/WNGUiVP0plxteChIPldsBmHY9NQCFXQO4Gek_4EQNrJUrBnpSXNcEoY_VIzwhZMoS_JHCK1Wzw=s88-c-k-c0x00ffffff-no-rj,False,False,1607821765.292386
UgzEL5Nr1tOGvxFbmJx4AaABAg,lmfaoo in hindsight they made iron man look like some wacky comedy-action movie and i can't stop laughing at how much i grew to love this man,3 years ago,@JL-zo1wd,UCq4z-uJeYLUVi7Ur-pRjUXA,2,,https://yt3.ggpht.com/ytc/AIdro_l_rc4bUQN0sEwfakmnzp25O2sQJU4-m5miGrb_r1prkQ=s88-c-k-c0x00ffffff-no-rj,False,False,1639357765.295387
Ugymspjq9hj4I-GWCwB4AaABAg,"2007 was a rough year for comic book movies, and Iron Man is a B list character in the comics.
Could be a decent movie. But I think people are tired of comic book movies and this won’t have much of an impact on this genre.",2 years ago,@gor9027,UCKjOslUWpN6_4CbZJrKfMJA,1,,https://yt3.ggpht.com/ytc/AIdro_moj_xsyBRskGnA0Km8Y8DosYAapALYMK_8CIsfHX0=s88-c-k-c0x00ffffff-no-rj,False,False,1670893765.298384
Ugw4zCTXPJa1Ks7uYIR4AaABAg,"This movie is brilliant, this and The Dark Knight helped save superhero movies in the 2000s, in the 2000s superhero movies we’re going through rough time. X-Men and Spider-Man had a very terrible third movie, and there was other silly trash like Ghost Rider and Fantastic Four that didn’t help. But then this movie came around, and boy was it something.",3 years ago,@blunew467,UCxsGb6wzifmY5o_dudmx0kA,5,,https://yt3.ggpht.com/_sYWG67dYbT3qkp1Nr21MJV6EzC5t1-22HVvbh2FIjX0ML_eiEYQL-nXYU7MCNbRZC0CcvEJhw=s88-c-k-c0x00ffffff-no-rj,False,False,1639357765.302402
UgxnQlBsKzMFyQp0tfd4AaABAg,"I get shivering chills when I'm returning and watching this again & again & again for billion and trillion times. Yep, Robert Downey Jr. portraying as Tony Stark aka Iron-man is where he built the armour & MCU's Marvel Studios. 💯💯💯💯👍👍👍👏👏👏👏💪💪💪",2 years ago,@klloydplata4098,UCLJgjhwzkAuDBlk4GFaX8qw,1,,https://yt3.ggpht.com/ytc/AIdro_m9dwHN34aAkSW4JYTNYdefsxtWq5MgMp23gOWgpwrlfQ=s88-c-k-c0x00ffffff-no-rj,False,False,1670893765.303399
UgwHCn4f-kEgICqEjq94AaABAg,"Wow if this does okay, I can maybe see a sequel in the future.  Could you imagine if Marvel made other titles like this though?  Don't mock me, i can dream.",4 years ago,@SequentiallyCompact,UC-9Hb5qYb_qHOQ6jWUVaNeA,8,,https://yt3.ggpht.com/ytc/AIdro_mXDXqW8xMJnvltresRiqCD-35ESnBBsAeVFKp8-V3fWw=s88-c-k-c0x00ffffff-no-rj,False,False,1607821765.306398
UgyeHWToyALfBmLWdPR4AaABAg,"If you see this comment, you're not the only one who misses old Marvel. Just the line, ""There are rumors going around that I'm parading around as some sort of super hero."" Is nostalgic because there weren't many around at all. Now, there are TOO many. The idea of someone becoming a superhero isn't special anymore because now, everyone is doing it. Anyone dumb enough to commit crime during this period in Marvel, where there's literally a superhero around the corner, deserves to be caught.",1 year ago (edited),@PlaytimeTM,UC6wbDmd6Sj86ewecDxqZbUA,1,,https://yt3.ggpht.com/txrdJRN7XjGE-E9p-kczutpqa9jil3KcIIYabmi_6JcZBuDAKx3Fb9BAc-Opoqt4FGNcl2Xitw=s88-c-k-c0x00ffffff-no-rj,False,False,1702429765.309396
UgymmOx1SJserZZiMdZ4AaABAg,"2:14 2:15

I was seven years old when i saw this movie it didn’t just become epic it became the birth of the Marvel Cinematic Universe",9 months ago (edited),@OptimusPrime298,UCJo8Zx0oNAXtLyLWn6gSi8g,0,,https://yt3.ggpht.com/9zJmbY709iccZWCkblorWJi15KdS6OmXa50OQyfJz5br6wi3RpDMVPA60m_1YTi7ONFQ1zFHY0Y=s88-c-k-c0x00ffffff-no-rj,False,False,1710288566.339416
Ugxa2Gn4PFHXvCXf-ux4AaABAg,"Iron man (Robert Downey Jr)
Spider Man (Tobey Maguire)
Captain america (Chris Evans)
Thor (Chris Hemsworth)
Hulk (Edward Norton)
Wolverine (Hugh Jackman)",3 years ago,@manassesnascimento4483,UCqBTprXnQ3Dr9TZ02H4Kp5g,2,,https://yt3.ggpht.com/T_ykyv2RPbMCZoHTIKmRdvlkZzeJat8aseD497EOvZuD2EN1y-NYqebV8IRT7GAiHEwPryvS=s88-c-k-c0x00ffffff-no-rj,False,False,1639357766.348448
UgxXWDRr6PW_u0d0FLV4AaABAg,Re watching all of the MCU movies after watching the MASTERPIECE that is Spiderman No way home To get ready for the next THOR movie and Doctor strange 2 as well as I haven't seen the Iron man movies in a few years and I wanna re live Robert's journey as Iron Man all the way thru Endgame,2 years ago,@Funeillusion,UCflNleRLfLbbGmeVT9QOL5g,1,,https://yt3.ggpht.com/ytc/AIdro_kBU7uA6lIZZEFphhckN-vBpBMnE0G157nI2YGwO6qn1-M=s88-c-k-c0x00ffffff-no-rj,False,False,1670893766.349448
Ugya7r0x8MMBV8XHsB94AaABAg,"No way home is awesome but without this guy and other original avengers, the future mcu movies doesn't look good",2 years ago,@dipendraverma2955,UC3sCyCInzTu5F_LzHghMRKg,3,,https://yt3.ggpht.com/ytc/AIdro_mtO-BjUNLb9ItoOLnW91mUo7fm85bsKuRnG2Wdh78=s88-c-k-c0x00ffffff-no-rj,False,False,1670893766.945581
UgyYuQY5f5LKvJTjrRd4AaABAg,trailer does do justice to how great this movie was in terms of an origin story setting up a whole generation for the MCU,1 year ago,@Daemon1995_,UCUdW7d9EOVfJElFh-J-96Jw,0,,https://yt3.ggpht.com/FXNCM48OLFLO9BkHB9CksZA4677DrX6_HFMEZgvNQMTQPmBX2sqlCLzV9gYzGC9dTrYJvXevAw=s88-c-k-c0x00ffffff-no-rj,False,False,1702429766.94958
Ugx95x2Dp7WJsktNrCt4AaABAg,When marvel made this film they did not know what they were getting into because 12 years later we have the best superhero films ever,4 years ago,@amehil8377,UC3Le87DfmwoPQkt6e6LAd4w,3,2,https://yt3.ggpht.com/ytc/AIdro_kN9_GXXDcjBnE9I1-xNGQfFIusTBo5qps0cqrviZM=s88-c-k-c0x00ffffff-no-rj,False,False,1607821766.951581
UgyYBJQaTuojB5eyJJ54AaABAg,I remember seeing this move in theaters in 2008  I was 11 or 12 and I always thought that was Al Pacino playing tony stark because Robert has the same look as Pacino he had the same hairstyle and beard as Al Pacino in Carlitos Way,2 years ago (edited),@kevinrivera6695,UC4tkwuKfNODghB3I6wI6Yqg,1,,https://yt3.ggpht.com/ytc/AIdro_lEobN3GbSAtWx5jp2YZQYdulHQoSJ5Xkza5B_I1ANxFVY=s88-c-k-c0x00ffffff-no-rj,False,False,1670893766.952581
Ugw__ckT71YVbN52yQV4AaABAg,And then that Paramount-logo in the corner at the end... God how I miss the old days when the mouse didn't buy other people's hard work,4 years ago,@falkofscrum,UCGiD6JyKV1ON4z7TfPtIeGg,30,5,https://yt3.ggpht.com/ytc/AIdro_kFFX93CGM-2Gs6W4gzeIDiAW8w_-VvKPfhd6vfLsM=s88-c-k-c0x00ffffff-no-rj,False,False,1607821766.954583
Ugxv7lMj9BrZISjeDbZ4AaABAg,"Little did we know, this was set in the same multiverse as the 2002 - 2007 Sam Raimi Spider-Man Trilogy, and the secret was uncovered 30 years later",2 years ago,@eggoryheffley7569,UCHI_DwL4lJuiS8UCYxx2YXA,5,,https://yt3.ggpht.com/N5uW22XmPwhuqMm0pkNMUWfciDBgVEo9_lJ_pgNIxHpZO-1QK3oeuJpgpDsj_2EXXxt-ClC9=s88-c-k-c0x00ffffff-no-rj,False,False,1670893766.957583
UgzLypxa0JhTxgd69a54AaABAg,"I feel like we tend to forget how good the first Iron Man was. With the market being oversaturated and the MCU in full force, ya kind of forget where we began.",11 months ago (edited),@MitchellFace,UCoJxeaF9F9lw4QmzEJuqV3g,0,,https://yt3.ggpht.com/5bGXi-OKYJltFF9yeeXKlNeckRw2fMkeaEwZ8-Fzk4Ez7LVw31xMgsNUIom0k88u54_QR44WYYA=s88-c-k-c0x00ffffff-no-rj,False,False,1705108166.963587
UgykyatTqhqCiEezjfF4AaABAg,It's crazy to think back to first seeing this trailer when I was a teenager and then where the MCU is now. I remember my Uncle (who got me into comics) and I were talking about it for weeks. And then finally seeing it. And then Nick Fury showing up. That was a wild time.,2 weeks ago,@Astrovite,UCG7aFoBhgyBRd7P56rh3iSQ,0,,https://yt3.ggpht.com/ytc/AIdro_nT5Da6v2gqOsowaDx1ZDNFSFjILWFrmlzpfntZEbPygGE=s88-c-k-c0x00ffffff-no-rj,False,False,1732842566.966588
Ugx95x2Dp7WJsktNrCt4AaABAg.9BkgICCZJc29BxNnMUIrWr,"The Dark Knight was released this same year, what does ""12 years later we would get the best superhero movies ever"" mean?",4 years ago,@y2123-l8c,UCL1Q9tLY6NNde2mMAn4E8DA,0,,https://yt3.ggpht.com/BAvrU7YAHahpua9RIWjYp6SlQpDHveM_rZ6Ibh4qrFLglkFF2bdFeNafCHXo5MvtEpCFmUHJvA=s88-c-k-c0x00ffffff-no-rj,False,True,1607821767.421475
Ugx95x2Dp7WJsktNrCt4AaABAg.9BkgICCZJc29PcoZ94x-HX, @y2123-l8c  I meant that I just prefer mcu over dc movies. I feel marvel characters can be a bit more relatable and developed but that’s just my opinion. I respect yours if you think differently,3 years ago,@amehil8377,UC3Le87DfmwoPQkt6e6LAd4w,0,,https://yt3.ggpht.com/ytc/AIdro_kN9_GXXDcjBnE9I1-xNGQfFIusTBo5qps0cqrviZM=s88-c-k-c0x00ffffff-no-rj,False,True,1639357767.422479
Ugw__ckT71YVbN52yQV4AaABAg.95q1HpZ1QLU9Ee4ZinOJ0E,Whoa such jealous person who says they don’t care about money 💰 lol you do care about money more then Disney,4 years ago,@bullrun2772,UCYL5vgAytMnQrdj4FpcPwWA,0,,https://yt3.ggpht.com/ytc/AIdro_khn2urXamHoiXhy_Wr_SUqfSpv-RYFeY9Qn40b0BEsCA=s88-c-k-c0x00ffffff-no-rj,False,True,1607821767.670316
Ugx7OBqa4sbr0UXLGMF4AaABAg,i remember when i first saw this trailer in the theatres i was like:   NO FN WAY!!!!!!!  They made Ironman!!!  Yessssss!!!!   I couldnt wait.   And I wasnt disappointed one bit when I saw it.... pure gold it is.,2 years ago,@hammerdown3876,UCNLhhUaWx4lb3mexD_gUpTg,0,,https://yt3.ggpht.com/ytc/AIdro_laWgsfAQbk-5WB5cEvlzm8OLSjt2lqgj2BLiV5GV000YQ=s88-c-k-c0x00ffffff-no-rj,False,False,1670893768.550052
Ugy74xx6Y15-tvaC9w94AaABAg,"If only we knew, how addicted to these stories we'd become, and now we're just waiting for the 4,and Proff X and his family to enter",4 years ago,@dr5911,UCc-osiTvWF3bOBpdQHNubNQ,3,,https://yt3.ggpht.com/ytc/AIdro_nbsVBLvP8rWDKTgccNfknITTf2J5wekVHQY9GrJWZeNGY=s88-c-k-c0x00ffffff-no-rj,False,False,1607821768.552053
Ugx8zR56gWB9_shCN1F4AaABAg,"its amazing just how clueless we all were back then. this was just an appetizer, but goddamn was it good.",3 years ago,@lilms.st3ak692,UCMusYfy547LDCWGbbdPQJVQ,2,,https://yt3.ggpht.com/ytc/AIdro_ms4uq8QuGFfcMqsK_f_jIjQJYbjnwc7ffwRLexD9KGcSED=s88-c-k-c0x00ffffff-no-rj,False,False,1639357768.553056
Ugw92m8KOuQAJ9iJHDV4AaABAg,Seeing this trailer made me realize we are getting old and now this movie looks like the 90s movies looked to us,2 years ago,@tagberli,UCdYXUZGWZvZBdZ2KvtEijww,2,,https://yt3.ggpht.com/Zo86SI-dcK-E8RgPekv0Ua5Xb4LKJSfTvCfSlgtmlGX5b_HlvtawVX2H6EtIEsywfHAPi7UShA=s88-c-k-c0x00ffffff-no-rj,False,False,1670893768.558048
Ugw2-ojFFeGe5bq1FzN4AaABAg,"Back then:-
Trailers were so cheap, while movies were great,

Nowadays:- 
Trailer is mind boggling while movie mind destroying!!😂😂😂",1 year ago,@JaspreetSingh-hf3rz,UCd7vbiTmTNa8tRO6KNi7x1A,1,,https://yt3.ggpht.com/ytc/AIdro_mrTRuC8u11EJGkAX2hnAVnfm5phUMHUl90-it7tAECx5M=s88-c-k-c0x00ffffff-no-rj,False,False,1702429768.560054
UgzbucTqdadIuxmK1dV4AaABAg,"""Part of the journey is the end""
       - Tony Stark.
""Some people move on, but not us""
       -  Steve Rogers, MCU fans.
""I am groot""
       -  Groot.",3 years ago (edited),@Leetheblackvoid99,UCC_FJcn737LZQmHqnl3dFaQ,1,,https://yt3.ggpht.com/ytc/AIdro_l8pL7EX9Wqg7Fk9EQiZsk3ev41_DI2x6K-6dnZZLo=s88-c-k-c0x00ffffff-no-rj,False,False,1639357770.243459
Ugz2eZ5K6HczYz4BHGR4AaABAg,"I feel so old watching this, growing up with marvel films from a young age, my god has marvel come far!!",2 years ago,@Masquerade01,UC_EDcotgyNlc-UFl55DCBcA,1,,https://yt3.ggpht.com/IBsOu0gJD8FFmasftSEZJ9v57gUfWvEKt1P4A5YPMtAS0EA98QoPHRI4MzZl8n-p_62a-sSReA=s88-c-k-c0x00ffffff-no-rj,False,False,1670893770.245458
