cid,Comment,time,author,channel,votes,replies,photo,heart,reply,time_parsed
UgxS5fpIx1At3Ms0g714AaABAg,"As much as I love what the MCU has become, I do miss the simplicity of the Phase 1 movies like Iron Man: just one superhero, no cosmic gems, no multiverse stuff, just a simple grounded origin story",3 years ago,@joeyjerry1586,UCEpa38pn2Jifpbn5qHgqpkg,1.6K,30,https://yt3.ggpht.com/1sE9qf_60kwzVvCggQUrlL0VsFvSAs6yIuM-GX30SFVp-grjUZS5EkJpZNPDvR-WAbes7-VP=s88-c-k-c0x00ffffff-no-rj,False,False,1639357752.182354
UgwLuOOB4I59Am1mo-54AaABAg,The scene of tony exploding the tank while not looking was one of the most badass scenes of this movie prove me wrong,4 years ago,@Gentoi,UC4AmqHdg_lzhzaOysSafEug,1.3K,21,https://yt3.ggpht.com/gHQnPLvQfSbiVy-TVcqqtmKCljkjj5mVX0HIulsdZbd2iOX_acKTsODezFXdZkak6IuXzKNIFyA=s88-c-k-c0x00ffffff-no-rj,False,False,1607821752.194362
UgyB-7IjNjxIu_X9R3d4AaABAg,"The beginning of an incredible saga. Really make me sad to go back to this to know where it ended, but what a terrific film.",1 year ago,@Fast85FoxGT,UCUE3tdyF9NBzk0lTWIPh8_w,32,,https://yt3.ggpht.com/ytc/AIdro_kzU59tj2ogENUUgR4ADe1LWquQ2NL3fl7Hyx1BW4Vx=s88-c-k-c0x00ffffff-no-rj,False,False,1702429752.213886
UgyHAqthpQ6D2POimlx4AaABAg.A1yUfr4xlOHA6_ZaifjhhQ,Yes. In fact this very movie is still very popular. One company in particular can stand by this statement- Hot Toys. They’re still making movie accurate Iron Man die cast metal action figures! Recently the released a 2.0 Mark 3. They will be releasing a 2.0 Mark 2 next year. You can bet I’m purchasing that Mark 3. I’ll be watching this trailer the day I buy that figure!,4 months ago,@thomaspixarmarvelfan,UC9ra85Dz0DBfh5ywmskF2-g,0,,https://yt3.ggpht.com/ytc/AIdro_lU4qhkkIvpehO9wRZ1pD99VQCBJyw5Fv95Z2Jh_72u-Ns=s88-c-k-c0x00ffffff-no-rj,False,True,1723507752.816726
Ugzy7gcy8rO_7u2MXA94AaABAg.95gZ167t12499kIaGP3iJm,I didn't care back then!  I was just so excited that they made Ironman into a movie and it looked like it was going to be good.  LOL,4 years ago,@pamtyler1259,UCpgWYvkqcrbURGa_rHNua0w,94,,https://yt3.ggpht.com/ytc/AIdro_lmGMvOf9DyIsHMLf5Anz3ZqMYXaYGdd1DsbhgUH6YuQxQ=s88-c-k-c0x00ffffff-no-rj,False,True,1607821753.086663
Ugzy7gcy8rO_7u2MXA94AaABAg.95gZ167t1249HZQJVPUSBK,They needed to sell their movies back then but now they don't need to because the hype has already bulit up,3 years ago,@wanderingsoul1551,UCvfPlng9SdkKrQmE2vwvRPQ,12,,https://yt3.ggpht.com/ytc/AIdro_kev0Lj7R8t3iADmhxH_jMq9sk-u_QsY8IoN7rwAnzihP0=s88-c-k-c0x00ffffff-no-rj,False,True,1639357753.089663
Ugzy7gcy8rO_7u2MXA94AaABAg.95gZ167t1249J125UaJXOj,this is true but i feel like they kinda had to give ppl a bit more because it was the start of the new company,3 years ago,@hiddenvalley17,UCVgJE7HYWvDioNu0Fp7Dcag,19,,https://yt3.ggpht.com/n6SRqKJd51KNYr4JfAmQzfFcVuBgQNBwpc5ijguvGD_mvlIKbR426Ux7aryDwgVKuoxLxyvLWQ=s88-c-k-c0x00ffffff-no-rj,False,True,1639357753.091679
Ugzy7gcy8rO_7u2MXA94AaABAg.95gZ167t1249UAdS_FpbGD,"True. But in their defense, how many people even knew who Iron Man or Tony Stark were in 2008. Comic book fans, sure, but who else? The trailer had to get people to want to see the film.",3 years ago,@Timasion,UCCRO1_-tVlEWLD-l4u3fepQ,3,,https://yt3.ggpht.com/ytc/AIdro_knlSB8KTHrZdwrpKpCdpRYSH4t7MUgjPDs3zui7izKLqo=s88-c-k-c0x00ffffff-no-rj,False,True,1639357753.447217
Ugzy7gcy8rO_7u2MXA94AaABAg.95gZ167t1249XPvxHh3tmo, @wanderingsoul1551  I don’t watch trailers anymore just cause of that reason. They show off too much,2 years ago,@TheMoises1213,UC-zwQc7LEM4WwMMG_8oQXHg,1,,https://yt3.ggpht.com/ytc/AIdro_mngMur5IheKk11UjenGUPW8b6pqRNjqaAQGOO7EogXNbo=s88-c-k-c0x00ffffff-no-rj,False,True,1670893753.450213
Ugzy7gcy8rO_7u2MXA94AaABAg.95gZ167t1249_MYX71p1TC,dude no offence but the original blade runner trailer show the whole movie as well movies do that since they came out it just the way they go you don't believe me go look at the trailer for the good the bad the ugly it basically tell the whole movie in the main official trailer,2 years ago,@jamesstewart4670,UCztTs72AoFU5-IU6Qib39_w,1,,https://yt3.ggpht.com/ytc/AIdro_k_XE3yskmy-xNgXIOFfs5slXbR262n2eV1XfrC5Ks=s88-c-k-c0x00ffffff-no-rj,False,True,1670893753.451216
Ugzy7gcy8rO_7u2MXA94AaABAg.95gZ167t1249eh1z5A3pd7,"At the time iron man wasn't a A-List superhero and Robert Downey was known as a crackhead, they had to make a good trailer or else",2 years ago,@_ripVanWinkle_,UCSI9bUYBOFSFcArMl_6kcsQ,1,,https://yt3.ggpht.com/1y3YAYGVcFGles4VGwqQzYpQFmsNkZC2iGscE05RcUztriPKKIl5Fn7W_0lqrNkD-xU19OTB8w=s88-c-k-c0x00ffffff-no-rj,False,True,1670893753.461183
Ugzy7gcy8rO_7u2MXA94AaABAg.95gZ167t1249r2z48hY1Ws,"This is not the official trailer. I remember it only showed 2-3 clips of Red Ironman suit for like 5 seconds each and not the previous one, no mark two. It showed No flight training scene, Nothing of the story. This is fake.",1 year ago (edited),@antoniistark16,UCdquQfKIZ1IB40KX8saGTEQ,2,,https://yt3.ggpht.com/ytc/AIdro_njMp9P5pDrqRaj4oHRodXslSma01EB2tIA4mBbGR7rDJoi92M1smujcI3N84wSKYdkGA=s88-c-k-c0x00ffffff-no-rj,False,True,1702429753.467173
UgxS5fpIx1At3Ms0g714AaABAg.9Q2w5_UeATQ9_s6UJ_83TL, @laisensei6984  Strong stories don't need a bunch of special effects to be worth telling. Iron Man and the early Marvel movies prove that.,2 years ago,@gabbym333,UCKVzEqdnI5NA-tESetVj7iA,47,,https://yt3.ggpht.com/ytc/AIdro_md9oIqWuMLRHAqmc6pALd8I60HLFJqlBzPwMdgzRv3TA=s88-c-k-c0x00ffffff-no-rj,False,True,1670893753.760613
UgxS5fpIx1At3Ms0g714AaABAg.9Q2w5_UeATQ9_sEgTUsslT," @gabbym333  That's not what I'm saying. I'm saying that if we only limit MCU's world view and story telling to Earth, it will eventually get boring. You gotta widen the scope at some point and introduce those cosmic beings into the scene.",2 years ago,@laisensei6984,UC5uO_BxCAa_tW8KRnR7S5tQ,36,,https://yt3.ggpht.com/ytc/AIdro_mg5n-SOz85JS0di6hu_8cWWyXRQuhX5Z8tkUMUitN0L18=s88-c-k-c0x00ffffff-no-rj,False,True,1670893753.761616
UgxS5fpIx1At3Ms0g714AaABAg.9Q2w5_UeATQ9aCrcfyiTXn,"Cosmic entities aren’t need at all, they do make a good story but they could have done a ton of movies before heading off earth",2 years ago,@NotDuncan,UCVhjuT6C0F_5MweCVW4rMCw,11,,https://yt3.ggpht.com/ytc/AIdro_nEZXlT0p2a8FdB6JMVBhsev5BDBPeAggP2Z6xQr0KVH_k=s88-c-k-c0x00ffffff-no-rj,False,True,1670893753.762645
UgxS5fpIx1At3Ms0g714AaABAg.9Q2w5_UeATQ9aCs6sd3reU," @NotDuncan , there’s a lot of MCU movies like that: Iron Man 1-3, Captain America 1-3, Black Widow, Shang Chi, Incredible Hulk, Ant-Man 1 and 2, Black Panther",2 years ago,@joeyjerry1586,UCEpa38pn2Jifpbn5qHgqpkg,8,,https://yt3.ggpht.com/1sE9qf_60kwzVvCggQUrlL0VsFvSAs6yIuM-GX30SFVp-grjUZS5EkJpZNPDvR-WAbes7-VP=s88-c-k-c0x00ffffff-no-rj,False,True,1670893753.762645
UgxS5fpIx1At3Ms0g714AaABAg.9Q2w5_UeATQ9aYg3Mpo_8H," @NotDuncan  Remember that MCU can only make so much movies in a year. Imagine if during the whole 10 years, they focused on stores based on earth only. It would take a lifetime to get to the Multiverse Saga.",2 years ago,@justinlasola2978,UCPor-w2dS5RBRjWlvH670LQ,6,,https://yt3.ggpht.com/ytc/AIdro_nIJMBVDBQZ1O4c_j4p4itBAZRZk7xpvodTCGxShS1GxYw=s88-c-k-c0x00ffffff-no-rj,False,True,1670893753.763655
UgxS5fpIx1At3Ms0g714AaABAg.9Q2w5_UeATQ9dM4n-c1KVM,"@Christopher Day, haven’t seen Thor 4 but I honestly loved doctor strange 2. Sure it was a multiversial movie but it wasn’t this big grand cosmic event that changed the mcu; it was a movie that focused on Strange and Wanda as characters even if some of the writing is pretty weak",2 years ago (edited),@joeyjerry1586,UCEpa38pn2Jifpbn5qHgqpkg,2,,https://yt3.ggpht.com/1sE9qf_60kwzVvCggQUrlL0VsFvSAs6yIuM-GX30SFVp-grjUZS5EkJpZNPDvR-WAbes7-VP=s88-c-k-c0x00ffffff-no-rj,False,True,1670893753.764634
UgxS5fpIx1At3Ms0g714AaABAg.9Q2w5_UeATQ9e4xnd66WEx,"I like it simple but I also do like the new side of marvel where these characters have powers and seeing the galaxy, every time I watch a new movie it blows my mind that you go from some guy building a suit to the multiverse. You just gotta get used to it I guess.",2 years ago,@Emilio.06,UC2ynbIw79Ijg6JjT7RyO8mQ,3,,https://yt3.ggpht.com/qDRrJRXL6seTCXo9pVzJ2AeG5GL7UYgpBZMk5juVG0CTuLuxXZZNQODJJE7nM88P0IjTTWJeaPA=s88-c-k-c0x00ffffff-no-rj,False,True,1670893753.766604
UgxS5fpIx1At3Ms0g714AaABAg.9Q2w5_UeATQ9hcAkSaVVa6," @laisensei6984  marvel is supposed to be street level heroes though, it has always shone by telling stories of humans rather than gods. DC does the ultra powered stuff well, but marvel has always been more relatable.",2 years ago,@Wabajak13,UCi3EybWWRGTwqyv3QcciKtA,1,,https://yt3.ggpht.com/ytc/AIdro_nzGtXDawuWKF73W1GZbrS9WpREhi9p8k3V34bK4X0rrg=s88-c-k-c0x00ffffff-no-rj,False,True,1670893754.029863
UgxS5fpIx1At3Ms0g714AaABAg.9Q2w5_UeATQ9lSAEaLNoi8,Yes. All that we need is The Incredible Hulk and Iron Man. Movies that you can just sit down and watch while not thinking about how the next movie will be impacted by all these events.,1 year ago,@Allison_XypprZ,UCc46HSrwNwnv7DRLL4ya5pQ,2,,https://yt3.ggpht.com/OlGeSWv9D2fQ9-25_suLHiIgxMlRh4SDu4iu6yAP2KTJ0Z1llrR13a0Hp4pOM3KoXwN-2uoKgg=s88-c-k-c0x00ffffff-no-rj,False,True,1702429754.031868
UgxS5fpIx1At3Ms0g714AaABAg.9Q2w5_UeATQ9oPghdVkRZf," @Destro7000 , well not anymore. I said that before we all realised the MCU didn’t care much about quality anymore. Still love Phases 1-3 but nowadays I get nervous whenever an MCU product comes up",1 year ago,@joeyjerry1586,UCEpa38pn2Jifpbn5qHgqpkg,0,,https://yt3.ggpht.com/1sE9qf_60kwzVvCggQUrlL0VsFvSAs6yIuM-GX30SFVp-grjUZS5EkJpZNPDvR-WAbes7-VP=s88-c-k-c0x00ffffff-no-rj,False,True,1702429754.033861
UgxS5fpIx1At3Ms0g714AaABAg.9Q2w5_UeATQ9qLCq6eV3yG,Well actually all 3 iron movies were simple and grounded however they don’t hold a candle to the first one.,1 year ago,@bigmann8932,UCbGbcekaX4gvYQh2HnWeDoQ,0,,https://yt3.ggpht.com/TvFIEmYuKOnV_kf0JjLjc54QOKte2KH0pcgyGcR2gMQv0GWSXq5e1Klmsq3gIqBuL_8zGmJZOg=s88-c-k-c0x00ffffff-no-rj,False,True,1702429754.036851
UgxS5fpIx1At3Ms0g714AaABAg.9Q2w5_UeATQ9xWLjpBGA-O,"Before the dark times of Disney. Scene stealing from DC, dodgy writing, retcons, poor cgi, introducing villians just to kill them off etc.",1 year ago,@jimbosolo9667,UCyVFIpC5kiy3bes9YETERKQ,0,,https://yt3.ggpht.com/ytc/AIdro_mYD0Xr-_dHjq-liMKFwCD_GLsq5jE8U3FYWq65r9s=s88-c-k-c0x00ffffff-no-rj,False,True,1702429754.038861
UgxS5fpIx1At3Ms0g714AaABAg.9Q2w5_UeATQA3yKddZwIP7,"Marvel phase 1-3 up to endgame were good with a few lackluster films (such as captain marvel, if you remove that one from the line up, then the Mcu would have been that much better) phase 4 is full of garbage (with the exception of no way home and guardians 3) with each film getting increasingly worse.",6 months ago,@geeebuttersnap2433,UCR5jTIGo6Dik9BKzCIPhciQ,1,,https://yt3.ggpht.com/ytc/AIdro_nORjyYIWeImlv59lRgvisV2wPTNRvaz6BPN6eJqOLH6WLF56Ie3Pd9ifSOmICck_CnBA=s88-c-k-c0x00ffffff-no-rj,False,True,1718237354.051861
UgxKBeYFk1gw8S0lz8V4AaABAg.8fVLyruF9Q794sAGjro4_o,"I remember watching the Tobey Spider-Man films, and thinking these are fun. But, when I watched Iron Man I was like, wow superhero movies can be really good!!",4 years ago,@connermckillips2372,UC-uxr8fdTId9kkPjt4F642Q,39,,https://yt3.ggpht.com/ytc/AIdro_k7Mgbvxze6gd4kckTG61LNzPEaMYgFa5Rkd_g1EHqKOeQ=s88-c-k-c0x00ffffff-no-rj,False,True,1607821754.289439
UgxKBeYFk1gw8S0lz8V4AaABAg.8fVLyruF9Q79CF_R1bdmyU,"Luka Mrse no I am an teenager I am 11 years old and I love almost all movies of MCU but till now Iron man is my most favorite character and IRON MAN (2008) is the best standalone movie of MCU I have watched 1st time Iron man in 2020 just 6 weeks ago and seriously, I gone crazy for the movie literally 
I love you 3000 iron man ❤",4 years ago,@riokodd1224,UCjqMVsFBbr9wfJ8-BbKv3YA,8,,https://yt3.ggpht.com/ytc/AIdro_lIfadmopujED9lMFwcGJxPQpilt4NZNibSDHfS59Q=s88-c-k-c0x00ffffff-no-rj,False,True,1607821754.682153
UgxKBeYFk1gw8S0lz8V4AaABAg.8fVLyruF9Q79KXf-gz4W5y,"I understand that sentiment to a degree but I actually disagree. Look at starwars. Starwars is timeless. It’s something that’s been enjoyed by multiple generations and more to come. If something is well put together and captivating, and popular it will always have a following.",3 years ago,@Bribickhed6,UCZ1BIWSEGA9-y5jy6kexloQ,3,,https://yt3.ggpht.com/ytc/AIdro_kyupnKYU4Mo9a6kUkoJcFPaFWWyyponm_JX2uyb8w=s88-c-k-c0x00ffffff-no-rj,False,True,1639357754.68419
UgxKBeYFk1gw8S0lz8V4AaABAg.8fVLyruF9Q79LcPm2Cuni0,"yeah it was tolerable then, but now it is super hero movies every week and they're the same repetitive crap.",3 years ago,@k.baller5140,UCFdXZKSFsCV55Znv8GsPdBA,4,,https://yt3.ggpht.com/ytc/AIdro_nEtKRlOHOyq2POOB1o2l8dwe5yGkzBYVc9wPIshuU=s88-c-k-c0x00ffffff-no-rj,False,True,1639357754.68519
UgxKBeYFk1gw8S0lz8V4AaABAg.8fVLyruF9Q79LzjtMwWWrF," Charlie Sosa  i agree before MCU the only good superhero movies were xmen, sam raimi's spider man and ill have to add Christopher Nolan's Batman. Everything else was trash",3 years ago,@jerryakamuadams6399,UC4iEbExnhENfHYI7jWp6Zcg,1,,https://yt3.ggpht.com/ytc/AIdro_kjUVrqCB6UWF75gLzU932nE3hFxWgq9DnF2J5ZgTdjAIb7ONkpz4bBRKOhrX02vgoUJA=s88-c-k-c0x00ffffff-no-rj,False,True,1639357754.686158
UgxKBeYFk1gw8S0lz8V4AaABAg.8fVLyruF9Q79NERMJgDxm7,"These films are forgotten now
Today, these films are not controversial
Because they are pure bullshit",3 years ago,@karangupta1825,UCZXvyslW_xp1IEWp4sLKkKg,3,,https://yt3.ggpht.com/ytc/AIdro_nKZ0i2YsnejU_xc7DU-iBmRsBv7gLl3rqorgUgpqg=s88-c-k-c0x00ffffff-no-rj,False,True,1639357754.68719
UgxKBeYFk1gw8S0lz8V4AaABAg.8fVLyruF9Q79Pai73RU-B2,"Pretty sure the same generation who saw this movie in theaters are still watching the new ones, and the ones who see just getting into these are going to go back to watch the old ones",3 years ago,@bluepeng8895,UClvdSajx06wykda0pL-SXyA,2,,https://yt3.ggpht.com/ytc/AIdro_mQi15Ov2tLwQ1iCGI_PrwUKk9ccMd6-NchnnZqjbX_8A=s88-c-k-c0x00ffffff-no-rj,False,True,1639357754.690148
UgyVa02XdP8rWriPSnl4AaABAg.9Mh6w3m_8tY9eh1wT4I4jy,"At the time iron man wasn't a A-List superhero and Robert Downey was known as a crackhead, they had to make a good trailer or else",2 years ago,@_ripVanWinkle_,UCSI9bUYBOFSFcArMl_6kcsQ,45,,https://yt3.ggpht.com/1y3YAYGVcFGles4VGwqQzYpQFmsNkZC2iGscE05RcUztriPKKIl5Fn7W_0lqrNkD-xU19OTB8w=s88-c-k-c0x00ffffff-no-rj,False,True,1670893754.943713
UgyVa02XdP8rWriPSnl4AaABAg.9Mh6w3m_8tY9r-qacRyJ0I,"what else to do men? this is the origin story & everybody knows what to expect. they watched it not to see the storyline, they watched it to see whether the film is good or bad,",1 year ago,@chathuralakshan542,UCLsVJJJi1oNUdHCrgx39ehw,5,,https://yt3.ggpht.com/ytc/AIdro_lo0VyDSrgeCcCW3YPGPejZIyeVzCCYiDY_eoTJW3Q=s88-c-k-c0x00ffffff-no-rj,False,True,1702429754.944714
Ugx-nYDeY70QjCNqSyN4AaABAg.8fOpIKRHt3n9LYi6Mv3CU2," @andrewsutherland133  
OP should have said between and not since. I was real tempted to post “Oh man, Iron Man and Infinity War both came out 10 years ago?” Until I saw the comments.",3 years ago,@halocrafter300,UCnwRxV6KnOdJTc4hnmfnzkQ,0,,https://yt3.ggpht.com/ytc/AIdro_mYC8ubYuRNevlr4mhlV117vZigjtNffVTEjmX3s4lM0Q=s88-c-k-c0x00ffffff-no-rj,False,True,1639357755.273023
UgwLuOOB4I59Am1mo-54AaABAg.9ADNix1ZrRR9M53JJArezD,"Let me tell you one thing - I belong from India and I started to use the Internet in 2012. I was 12 years old when this movie came out. But there were no theatres near where I lived. Also on tv, they didn't put the trailer. I was dying to see this masterpiece. And this rocket firing scene was the only piece of the movie which I saw for 3 years (on some cable ads) until I got to see the whole film in 2011.",3 years ago,@VY-zt3ph,UCjBz-7DPNfA0SwX_RwQzdAg,27,,https://yt3.ggpht.com/ytc/AIdro_k7G2XVQM4t36HH-rympN5LlZsdCppzsq-Zoa-eT8Y=s88-c-k-c0x00ffffff-no-rj,False,True,1639357755.775116
UgwLuOOB4I59Am1mo-54AaABAg.9ADNix1ZrRR9PdArp2w0aB,"Maybe. But I’ll see your claim and raise you a Thor Cap and Tony looking at Thanos and Thor lightning transforming.

Just as long we’re in agreement lol",3 years ago,@sdzyde7482,UCP7bjila8cqaPBRApCFKzUQ,3,,https://yt3.ggpht.com/ytc/AIdro_mLKo4zn4ghlVvSWH-Y2qRXHhemowyv5O-IaLuog671NQ=s88-c-k-c0x00ffffff-no-rj,False,True,1639357755.776116
UgwLuOOB4I59Am1mo-54AaABAg.9ADNix1ZrRR9RZ5JpNjQUD,"yes true , but the most important part/scene is ""don't waste your life"" and this is what made tony stark  to iron man and all this happened , thanks yinsen.",3 years ago,@shubhamsumit9161,UCwHJ8XYg_jwyuuHuLLzaU1g,3,,https://yt3.ggpht.com/ytc/AIdro_lVZ8hgv-OGiaqzXKBiVhbLlXCmmiVXmLuMxG_uebaJ6w=s88-c-k-c0x00ffffff-no-rj,False,True,1639357755.777115
UgwLuOOB4I59Am1mo-54AaABAg.9ADNix1ZrRR9l74LTaoG1X," @goodbadbill  The addition of Black Sabbath music exactly with Tony' march in this trailer, is what makes it UNIQUE....!",1 year ago,@JohnDoe-cc4xp,UCxxpbfrS0D6hVJ8hhs1wIig,0,,https://yt3.ggpht.com/ytc/AIdro_keMQE_AZwgEV9iwqsEsIfwbmknyjGhrjvE7WBLQSgMvw=s88-c-k-c0x00ffffff-no-rj,False,True,1702429756.012449
UgwLuOOB4I59Am1mo-54AaABAg.9ADNix1ZrRRA3kwQtGrLRF,"and you know whats best? it wasnt one of those bs ""im cool"" walk aways, instead there was a reason for him to walk that way, he was moving towards his next objective a few steps further",6 months ago,@Paradoxical_heuer,UCWKlgYrFDj5U7d17sXVN1iQ,0,,https://yt3.ggpht.com/e1N7JIV4qijraS_cI3ySOaMfAprUIg-Vt6-FBh2HCq9QecJpAKOI3EVrPTWsDnoN7R8F28WAuw=s88-c-k-c0x00ffffff-no-rj,False,True,1718237356.018444
UgwLuOOB4I59Am1mo-54AaABAg.9ADNix1ZrRRA6UTRt5qA1v,"Just looks long enough to check the missile has gone in the tank and casually turns and walks, love it!",4 months ago,,UCFGnHxhyhJalLWztaH4LTDg,0,,https://yt3.ggpht.com/ytc/AIdro_kOrnrlWifFJPFrLV84LZRHW3Qq8FwVqSBRLkwtz7Ulk4U=s88-c-k-c0x00ffffff-no-rj,False,True,1723507756.022443
Ugz4PrDseNfv6LxnghJ4AaABAg.8goY4fqvmhI9Lzk8X6I9pU,yup. even the iron man theme in this movie has a guitar with heavy riffs. In ironman 2 and 3 they changed the theme to have more of an ensemble orchestra sound.,3 years ago,@jerryakamuadams6399,UC4iEbExnhENfHYI7jWp6Zcg,1,,https://yt3.ggpht.com/ytc/AIdro_kjUVrqCB6UWF75gLzU932nE3hFxWgq9DnF2J5ZgTdjAIb7ONkpz4bBRKOhrX02vgoUJA=s88-c-k-c0x00ffffff-no-rj,False,True,1639357756.281626
Ugz4PrDseNfv6LxnghJ4AaABAg.8goY4fqvmhI9tDJQlneS0P,"​ @shillofnothing9195 A little late to answer, but that's ""Cochise"" by Audioslave. A hell of a banger!",1 year ago (edited),@alejandrocamberosrodriguez4222,UC6Gfph2xuOcmy-OGe2FcEeg,1,,https://yt3.ggpht.com/ytc/AIdro_n9cMFpSfETSej6GRcdMN21gfH2-K_WVIOQY0I8DTRb=s88-c-k-c0x00ffffff-no-rj,False,True,1702429756.285633
Ugx5CiAxje8dWDdVTjp4AaABAg.9AnVlAv3ml39Lqnr8mSAGQ, @tx_7134  actually it starts with Captain Marvel. She’s the reason Nick Fury decided to start the Avengers initiative.,3 years ago,@SpiderManMCUniverse,UCRN_r9X232ku--U0DLUVSAQ,8,,https://yt3.ggpht.com/ITk_8hmt5ad3RNFcSsv8S2kyqaUQeSSahDN5_7jpOf-kaxHDz2JX67uXLaRvzIzgia12lvoLXg=s88-c-k-c0x00ffffff-no-rj,False,True,1639357756.838422
Ugx5CiAxje8dWDdVTjp4AaABAg.9AnVlAv3ml39MrFRg4s97N," @tx_7134  No, he’s the first Avenger because he was alive decades before people like Tony and Bruce and others. Thor doesn’t count because he’s not human. Also Steve was the only one back in his time to do heroic acts and ‘avenge’.",3 years ago,@SpiderManMCUniverse,UCRN_r9X232ku--U0DLUVSAQ,4,,https://yt3.ggpht.com/ITk_8hmt5ad3RNFcSsv8S2kyqaUQeSSahDN5_7jpOf-kaxHDz2JX67uXLaRvzIzgia12lvoLXg=s88-c-k-c0x00ffffff-no-rj,False,True,1639357756.840422
Ugx5CiAxje8dWDdVTjp4AaABAg.9AnVlAv3ml3A6p4I_WDMU5,"​@tx_7134 Came to the sub comments looking for this, wasnt disappointed. Theres always gotta be some dork know it all. ""Well AKSHUALLY....."" 🙄",4 months ago,@DeepPocketsEnt,UClw8EpRc6e-kMULrNGv58Vw,0,,https://yt3.ggpht.com/ytc/AIdro_l1Nh83gzIFtzNRZle1JOD0ZDPhdST3HqS8cS9-2Yc=s88-c-k-c0x00ffffff-no-rj,False,True,1723507756.86046
UgySBOwtIfLrKv-jdml4AaABAg.9MqsmPOYpFG9PzF47CvvVj,"I know it wasn’t it still isn’t a part of the MCU but Spider-Man, (The Raimi Movies) Are kinda what made the MCU, well the MCU!",3 years ago,@kevin_dur4nt,UCXtCofjMQa_V56EV9qjIL2w,2,,https://yt3.ggpht.com/PPQm3WCIOD34ddl4n5efnOjBD8qc6D2vvGrigaB9lwBz5yqJx0io4srNI7C1RPlOzEAjE4_c9w=s88-c-k-c0x00ffffff-no-rj,False,True,1639357757.323984
UgxJ-XC5AY65QOZk-5h4AaABAg.8uDOqPjoi4T93zRwddcZl0,He's dead? When did he die? It's been 12 years since Iron Man released. They haven't created another movie since then. How do you know he's dead?,4 years ago,@scuproductions,UCFqBjQEjyKVujYGDAOXacyA,0,,https://yt3.ggpht.com/tSJiPN6XDbG8ufyVxDsysMgSWKs71jB92GxSNHMphnTpPSxmDfdcFfotcZdj9bkH8RRPi4os0g=s88-c-k-c0x00ffffff-no-rj,False,True,1607821757.568959
UgxJ-XC5AY65QOZk-5h4AaABAg.8uDOqPjoi4T93zqD0stdu6," @katerinaloizou3485  no. By the way who is that in your profile picture? Anyways I just am excited for Iron Man 2. Whenever if comes out. Hope he doesn't ""die"".",4 years ago,@scuproductions,UCFqBjQEjyKVujYGDAOXacyA,0,,https://yt3.ggpht.com/tSJiPN6XDbG8ufyVxDsysMgSWKs71jB92GxSNHMphnTpPSxmDfdcFfotcZdj9bkH8RRPi4os0g=s88-c-k-c0x00ffffff-no-rj,False,True,1607821757.57092
UgxkBYb3kAUG0WIwaKN4AaABAg.9QqAhiEVZP09lEv8U6i4Ek,"Why do I get the feeling that now that the DCEU is being rebooted, they are going to steal that iconic tagline and use it for a future solo Cyborg movie? 😓😓😓",1 year ago,@TroyDyamondWilson,UCeWl-iFPR_5TYIwiAcULxPg,5,,https://yt3.ggpht.com/VU3ytPLJ58E7muKGE7Gdm8UO44lbAOwNopzPmzXmSvBNApXszVXlpyaDfAWmaLxSseuqH9wclQ=s88-c-k-c0x00ffffff-no-rj,False,True,1702429758.75431
Ugz9VGsDUNGO8baPJTB4AaABAg,The editing of trailers also have changed a lot. They basically gave away the entire movie chronologically. But damn still one of the best marvel movie!!,5 years ago,@mathavraj9378,UCr9TG3_46JHNBHSVhuJ1Dvw,67,3,https://yt3.ggpht.com/ytc/AIdro_kZl59t2I-9aEtGHWE3Jo3-KopTCMhRe_WmOr9IXkSnEA=s88-c-k-c0x00ffffff-no-rj,False,False,1576199359.150931
UgyFxVvotnL9eXtmaYh4AaABAg,Kids will never know what it feels like watching the entire MCU unfold over 12 years and waiting for the next film to come out.,3 years ago,@Mf7d89,UCV3X4CfXv3z1OBlZmgqAeNA,160,4,https://yt3.ggpht.com/ytc/AIdro_miP2TbGGf56k8WKTe9FeBSrnsx6FmuoA8QrL5SXqcLnNQ=s88-c-k-c0x00ffffff-no-rj,False,False,1639357759.154931
Ugzzg3tk3G1MprQ3pVx4AaABAg,"As of now, I’m a 27 year old man. Back in 2008 this movie blew my mind and to this day Iron Man/Tony Stark still remains my all time favorite super hero.",6 months ago,@benmorgan8890,UClIs9wN_Y-f-Bfxni1Zz0lg,1,,https://yt3.ggpht.com/ytc/AIdro_nfE-5osmPN2pe5Epvg4dvZzcM-8PMDtxIUk89i5eo=s88-c-k-c0x00ffffff-no-rj,False,False,1718237359.171925
UgzCWVScXArEfuWxkLF4AaABAg,"Iron Man 1 was so good, I remember going to watch it with my friends, I was in 7th grade at the time, we had no idea what to expect, the movie was absolutely amazing, Robert Downey Jr. was born to play Tony Stark, the post credits scene with Nick Fury talking about the Avengers initiative blew me away! now to look back at this movie, and what it started feels surreal man! The beginning of the MCU 👏👏👏👏",1 year ago,@anasshahid224,UCRWKz5YYl24Ag7dZXHWLncg,9,,https://yt3.ggpht.com/Al3fNgEu67Hf_ftPrWbv7rEgaH-AdW5qVVwlQqEGMeQa5ehJW4ExJc1z-alEA0gMP7U-wbbZ=s88-c-k-c0x00ffffff-no-rj,False,False,1702429759.172925
UgzuT1lq4YqmJ3Oaqwh4AaABAg,They way they play Black Sabbath towards the end is what made this trailer one of the best in the MCU,4 years ago,@dustinlong4370,UCon4TLwEaOKa06ws2L3JhOg,14,,https://yt3.ggpht.com/RjTdQzzbv7DxwgW3ALBPI56-cFcs8v1dj2agLgiRSO-_ZbVxPyzNqnGtkM5e2VqsyQyiauCvdg=s88-c-k-c0x00ffffff-no-rj,False,False,1607821759.175926
UgzM8qUBa-6uvJUBA_p4AaABAg,"Looking at infinity war and all the movies from the last maybe five years, iron man definitely is such a different film. Then it was revolutionary and it still is.",5 years ago,@nherrer98,UCH_kKZSHkP8Q0C3kA_ySnTw,15,,https://yt3.ggpht.com/ytc/AIdro_kBd9bt2qdlpcpz_UZRcsaI9p8i9exw1C75Udwwc9SQtCA=s88-c-k-c0x00ffffff-no-rj,False,False,1576199359.176926
UgylEE1Ft_XT219Ulrp4AaABAg.96ZgrNdLNuV9eh20Sc_fDR,"At the time iron man wasn't a A-List superhero and Robert Downey was known as a crackhead, they had to make a good trailer or else",2 years ago,@_ripVanWinkle_,UCSI9bUYBOFSFcArMl_6kcsQ,2,,https://yt3.ggpht.com/1y3YAYGVcFGles4VGwqQzYpQFmsNkZC2iGscE05RcUztriPKKIl5Fn7W_0lqrNkD-xU19OTB8w=s88-c-k-c0x00ffffff-no-rj,False,True,1670893759.636577
Ugw_oVZh6mi44nOpdz54AaABAg.950kvr3UrVQ9Sy0MjSot64," @nicolasb7795  Really? A Captain America movie? I can’t see that working out well. Just imagine if they did a Thor movie though, that’d be dumb.",3 years ago,@jonathandelgado3755,UCb6LJNW_JjP6q_ThWQWrMuQ,8,,https://yt3.ggpht.com/ytc/AIdro_kpg_yB2lfTq7kEhkJGTHbUDPwW1MlHEw5Nhkt3h1S2a5g=s88-c-k-c0x00ffffff-no-rj,False,True,1639357759.908158
Ugw_oVZh6mi44nOpdz54AaABAg.950kvr3UrVQ9W1MBWtubDB," @user-by4nd5yg8e  eh, i feel like they'd need to elaborate on iron man a bit more after that crossover
maybe thor and captain america too",2 years ago,@jockeyfield1954,UC9CGgWOTa0eXQTjoc2KqdMQ,4,,https://yt3.ggpht.com/ytc/AIdro_kZKjetJ6LaDwC39wN5DI-SAeXPZNH4_HJF2IWkcWaAb9r3=s88-c-k-c0x00ffffff-no-rj,False,True,1670893759.911157
Ugz9VGsDUNGO8baPJTB4AaABAg.8uPNgxUiG1B9FAPYNXjhtK,"This isn't the original trailer, this looks more like the DVD release trailer rather than the theatrical trailer. This is the original theatrical trailer, you'll see they give a lot less away, DVD trailers can get away with showing more because many people have already seen the movie.",4 years ago,@JMan9191991,UCgDHOMu_SkzqNamMgvQL9Vw,2,,https://yt3.ggpht.com/ytc/AIdro_mjhXQKINkoghmo1Rscn-Jnf50v0CMilvMlr9l228yyKw=s88-c-k-c0x00ffffff-no-rj,False,True,1607821760.375422
